All Transactions Announced Date,Target/Issuer,Transaction Types,Transaction Status,Buyers/Investors,Sellers/Sponsor,CIQ Transaction ID,First Trade Date [1/1/2015-12/7/2020] [Primary Listing] [Target/Issuer],Company Status [Target/Issuer]
10/03/2018,22 Capital Corp.,Merger/Acquisition,Closed,Trichome Financial Corp. (CNSX:TFC),-,IQTR585129350,"TSXV:LFC.P
Company: 22 Capital Corp.
(IQT427808283) - 5/12/2017",Acquired
07/25/2017,22 Capital Corp.,Merger/Acquisition,Cancelled,nDivision Inc. (OTCPK:NDVN),AJKNJ Capital Corp.,IQTR532054974,"TSXV:LFC.P
Company: 22 Capital Corp.
(IQT427808283) - 5/12/2017",Acquired
07/10/2019,8i Enterprises Acquisition Corp.,Merger/Acquisition,Closed,Diginex Limited (NasdaqCM:EQOS),-,IQTR628920875,"NasdaqCM:EQOS
Company: 8i Enterprises Acquisition Corp.
(IQT593862819) - 5/16/2019",Acquired
11/08/2016,A2 Acquisition Corp.,Merger/Acquisition,Closed,Medicenna Therapeutics Corp. (TSX:MDNA),Silver Lining Homes Ltd.,IQTR419229043,"TSXV:APD.P
Company: A2 Acquisition Corp.
(IQT306486956) - 7/14/2015",Acquired
03/25/2020,AAJ Capital 2 Corp. (TSXV:AAJC.P),Merger/Acquisition,Cancelled,Asia Interactive Services (Hong Kong) Limited,-,IQTR660598645,"TSXV:AAJC.P
Company: AAJ Capital 2 Corp.
(IQT602883694) - 8/26/2019",Operating
10/18/2019,AAJ Capital 2 Corp. (TSXV:AAJC.P),Merger/Acquisition,Cancelled,HB Brand Partners Inc.,-,IQTR641063100,"TSXV:AAJC.P
Company: AAJ Capital 2 Corp.
(IQT602883694) - 8/26/2019",Operating
12/30/2019,Abigail Capital Corporation (TSXV:ACC.P),Merger/Acquisition,Cancelled,Climb Credit Inc.,-,IQTR649555274,"TSXV:ACC.P
Company: Abigail Capital Corporation
(IQT634570129) - 10/22/2019",Operating
10/22/2020,Acamar Partners Acquisition Corp. (NasdaqCM:ACAM),Merger/Acquisition,Announced,"CarLotz, Inc.","Transportation Resource Partners, LP",IQTR692757786,"NasdaqCM:ACAM
Company: Acamar Partners Acquisition Corp.
(IQT604581070) - 5/9/2019",Operating
08/13/2019,ADL Ventures Inc.,Merger/Acquisition,Closed,The Real Brokerage Inc. (TSXV:REAX),-,IQTR633151348,"TSXV:REAX
Company: ADL Ventures Inc.
(IQT571725415) - 7/6/2018",Acquired
05/12/2020,AF1 Capital Corp. (TSXV:AFC.P),Merger/Acquisition,Announced,"PureKana, LLC",-,IQTR667853750,"TSXV:AFC.P
Company: AF1 Capital Corp.
(IQT579856387) - 1/31/2019",Operating
01/04/2018,AIM1 Ventures Inc.,Merger/Acquisition,Closed,James E. Wagner Cultivation Corporation (TSXV:JWCA.H),"Interward Asset Management Ltd.; 2538243 Ontario Inc.; Dorylin Holdings Inc., Asset Management Arm",IQTR548510062,"TSXV:AIMI.P
Company: AIM1 Ventures Inc.
(IQT530052715) - 9/7/2017",Acquired
05/30/2018,Aim2 Ventures Inc.,Merger/Acquisition,Closed,Canopy Rivers Inc. (TSX:RIV),-,IQTR568762458,"TSXV:AIMB.P
Company: Aim2 Ventures Inc.
(IQT548453337) - 2/14/2018",Acquired
01/21/2020,AIM3 Ventures Inc.,Merger/Acquisition,Closed,Vox Royalty Corp. (TSXV:VOX),-,IQTR651863456,"TSXV:AIMC.P
Company: AIM3 Ventures Inc.
(IQT581440953) - 11/15/2018",Acquired
01/21/2019,AIM3 Ventures Inc.,Merger/Acquisition,Cancelled,Southern Sun Pharma Inc.,-,IQTR599152007,"TSXV:AIMC.P
Company: AIM3 Ventures Inc.
(IQT581440953) - 11/15/2018",Acquired
10/14/2020,AIM4 Ventures Inc. (TSXV:AIMD.P),Merger/Acquisition,Announced,TRC Management Holdings Corp.,-,IQTR691856751,"TSXV:AIMD.P
Company: AIM4 Ventures Inc.
(IQT610588085) - 7/5/2019",Operating
02/19/2020,A-Labs Capital I Corp. (TSXV:ALBS.P),Merger/Acquisition,Announced,BTC Corporation Holdings Pty Ltd.,-,IQTR655541422,"TSXV:ALBS.P
Company: A-Labs Capital I Corp.
(IQT579903676) - 11/22/2018",Operating
02/11/2019,A-Labs Capital I Corp. (TSXV:ALBS.P),Merger/Acquisition,Cancelled,Hisense Ltd.,-,IQTR602006990,"TSXV:ALBS.P
Company: A-Labs Capital I Corp.
(IQT579903676) - 11/22/2018",Operating
10/02/2020,A-Labs Capital II Corp. (TSXV:ALAB.P),Merger/Acquisition,Announced,RDARS Inc.,-,IQTR690745603,"TSXV:ALAB.P
Company: A-Labs Capital II Corp.
(IQT587641241) - 3/18/2019",Operating
10/16/2019,A-Labs Capital II Corp. (TSXV:ALAB.P),Merger/Acquisition,Cancelled,S.R.P. Plus Holdings Ltd.,-,IQTR640738369,"TSXV:ALAB.P
Company: A-Labs Capital II Corp.
(IQT587641241) - 3/18/2019",Operating
10/28/2020,Alberton Acquisition Corporation (NasdaqCM:ALAC),Merger/Acquisition,Announced,"SolarMax Technology, Inc.",-,IQTR693398073,"NasdaqCM:ALAC
Company: Alberton Acquisition Corporation
(IQT592001732) - 11/21/2018",Operating
11/01/2016,Alignvest Acquisition Corporation,Merger/Acquisition,Closed,Trilogy International Partners Inc. (TSX:TRL),"Alignvest Management Corporation; Silver Pine Partners, LLC",IQTR408359024,"TSX:AQX.A
Company: Alignvest Acquisition Corporation
(IQT308100670) - 8/5/2015",Acquired
11/08/2019,Allegro Merger Corp.,Merger/Acquisition,Cancelled,TGI Friday's Inc.,-,IQTR643559081,"NasdaqGM:ALGR
Company: Allegro Merger Corp.
(IQT543081182) - 8/13/2018",Operating
12/19/2018,ALP.I S.p.A.,Merger/Acquisition,Closed,Antares Vision S.p.A. (BIT:AV),-,IQTR596080523,"BIT:ALPI
Company: ALP.I S.p.A.
(IQT549639941) - 2/1/2018",Acquired
11/03/2020,Alphanco Venture Corp. (TSXV:AVC.P),Merger/Acquisition,Announced,Marvel Biotechnology Inc.,-,IQTR693934550,"TSXV:AVC.P
Company: Alphanco Venture Corp.
(IQT594231572) - 3/4/2019",Operating
10/13/2020,AMCI Acquisition Corp. (NasdaqCM:AMCI),Merger/Acquisition,Announced,Advent Technologies Inc.,-,IQTR691587895,"NasdaqCM:AMCI
Company: AMCI Acquisition Corp.
(IQT576453700) - 1/23/2019",Operating Subsidiary
11/21/2019,AmWolf Capital Corp. (TSXV:AMW.P),Merger/Acquisition,Announced,Pontus Water Lentils Ltd.,-,IQTR645177418,"TSXV:AMW.P
Company: AmWolf Capital Corp.
(IQT579194734) - 5/27/2019",Operating
11/15/2018,Anchor Capital Corporation,Merger/Acquisition,Closed,Spyder Cannabis Inc. (TSXV:SPDR),-,IQTR591430945,"TSXV:SPDR
Company: Anchor Capital Corporation
(IQT278897683) - 4/7/2015",Acquired
11/05/2018,Anchor Capital Corporation,Merger/Acquisition,Closed,-,-,IQTR590298598,"TSXV:SPDR
Company: Anchor Capital Corporation
(IQT278897683) - 4/7/2015",Acquired
11/22/2016,Anchor Capital Corporation,Merger/Acquisition,Cancelled,"Mark One Lifestyle, Inc.",-,IQTR423541978,"TSXV:SPDR
Company: Anchor Capital Corporation
(IQT278897683) - 4/7/2015",Acquired
11/30/2015,Anchor Capital Corporation,Merger/Acquisition,Cancelled,Clip Interactive LLC,-,IQTR374233556,"TSXV:SPDR
Company: Anchor Capital Corporation
(IQT278897683) - 4/7/2015",Acquired
07/22/2020,Andina Acquisition Corp. III (NasdaqCM:ANDA),Merger/Acquisition,Cancelled,Emmac Life Sciences Limited,-,IQTR678041736,"NasdaqCM:ANDA
Company: Andina Acquisition Corp. III
(IQT574975950) - 3/6/2019",Operating
07/27/2020,Antera Ventures I Corp. (TSXV:ANTI.P),Merger/Acquisition,Announced,Wishpond Technologies Ltd.,-,IQTR679134250,"TSXV:ANTI.P
Company: Antera Ventures I Corp.
(IQT583228392) - 5/7/2019",Operating
11/23/2020,Apex Technology Acquisition Corporation (NasdaqCM:APXT),Merger/Acquisition,Announced,"AvePoint, Inc.",-,IQTR695958475,"NasdaqCM:APXT
Company: Apex Technology Acquisition Corporation
(IQT630485529) - 11/5/2019",Operating Subsidiary
08/13/2020,Aphelion Capital Corp. (TSXV:APHE.P),Merger/Acquisition,Announced,ETI Technologies Inc./Edge AI Ltd.,-,IQTR683542365,"TSXV:APHE.P
Company: Aphelion Capital Corp.
(IQT634673401) - 3/31/2020",Operating
11/07/2017,Apolo Acquisition Corp.,Merger/Acquisition,Closed,CryptoGlobal Corp.,-,IQTR542907581,"TSXV:CPTO
Company: Apolo Acquisition Corp.
(IQT534602728) - 8/17/2017",Acquired
11/13/2018,Apolo II Acquisition Corp.,Merger/Acquisition,Closed,Terrace Global Inc. (TSXV:TRCE),-,IQTR591150631,"TSXV:APII.P
Company: Apolo II Acquisition Corp.
(IQT549345268) - 3/14/2018",Acquired
11/11/2020,Apolo III Acquisition Corp. (TSXV:AIII.P),Merger/Acquisition,Announced,Ruckify Inc.,-,IQTR694656106,"TSXV:AIII.P
Company: Apolo III Acquisition Corp.
(IQT553393377) - 4/9/2018",Operating
05/21/2019,Apolo III Acquisition Corp. (TSXV:AIII.P),Merger/Acquisition,Cancelled,Latitude Global Cannabis Inc.,-,IQTR614337176,"TSXV:AIII.P
Company: Apolo III Acquisition Corp.
(IQT553393377) - 4/9/2018",Operating
07/30/2020,ARYA Sciences Acquisition Corp II,Merger/Acquisition,Closed,"Cerevel Therapeutics Holdings, Inc. (NasdaqCM:CERE)","Bain Capital, LP",IQTR681235905,"NasdaqCM:CERE
Company: ARYA Sciences Acquisition Corp II
(IQT668692071) - 7/30/2020",Acquired
03/17/2020,ARYA Sciences Acquisition Corp.,Merger/Acquisition,Closed,Immatics N.V. (NasdaqCM:IMTX),-,IQTR659132906,"NasdaqGM:ARYA
Company: ARYA Sciences Acquisition Corp.
(IQT589803061) - 12/12/2018",Acquired
12/01/2015,"Asia Equity Exchange Group, Inc.",Merger/Acquisition,Closed,"Asia Equity Exchange Group, Inc. (OTCPK:AEEX)",-,IQTR318226848,"OTCBB:AEEX
Company: Asia Equity Exchange Group, Inc.
(IQT331402770) - 12/1/2015",Acquired
04/03/2018,Atlantic Acquisition Corp.,Merger/Acquisition,Closed,HF Foods Group Inc. (NasdaqCM:HFFG),"Karpus Management Inc.; Polar Asset Management Partners Inc.; Bulldog Investors, LLC; 683 Capital Management, LLC; Periscope Capital Inc; Boothbay Fund Management, LLC",IQTR558011870,"NasdaqCM:ATAC
Company: Atlantic Acquisition Corp.
(IQT530369103) - 9/7/2017",Acquired
05/08/2017,Atlantic Alliance Partnership Corp.,Merger/Acquisition,Cancelled,Kalyx Development Inc.,Polar Asset Management Partners Inc.; Oxford Asset Management LLP,IQTR430112152,"OTCPK:AAPC.F
Company: Atlantic Alliance Partnership Corp.
(IQT292985242) - 4/30/2015",Operating
03/24/2016,Atlantic Alliance Partnership Corp.,Merger/Acquisition,Cancelled,Hawkwing plc (LSE:HNG),Polar Asset Management Partners Inc.; AAP Sponsor (PTC) Corp.,IQTR329091604,"OTCPK:AAPC.F
Company: Atlantic Alliance Partnership Corp.
(IQT292985242) - 4/30/2015",Operating
11/08/2016,Aumento Capital V Corporation,Merger/Acquisition,Closed,WeedMD Inc. (TSXV:WMD),-,IQTR408996658,"TSXV:AMN.P
Company: Aumento Capital V Corporation
(IQT274081604) - 5/22/2015",Acquired
12/22/2017,Aumento Capital VI Corporation,Merger/Acquisition,Closed,CryptoStar Corp. (TSXV:CSTR),Zambian Holdings Inc.,IQTR547601098,"TSXV:AUO.P
Company: Aumento Capital VI Corporation
(IQT431508106) - 9/18/2017",Acquired
05/27/2020,Aumento Capital VII Corporation (TSXV:AUOC.P),Merger/Acquisition,Announced,Paul Pathak Professional Corporation,-,IQTR669496817,"TSXV:AUOC.P
Company: Aumento Capital VII Corporation
(IQT551065894) - 3/29/2018",Operating
05/19/2020,Aumento Capital VII Corporation (TSXV:AUOC.P),Merger/Acquisition,Announced,EMERGE Commerce Inc.,-,IQTR668607701,"TSXV:AUOC.P
Company: Aumento Capital VII Corporation
(IQT551065894) - 3/29/2018",Operating
04/20/2020,Auston Capital Corp. (TSXV:ASTN.P),Merger/Acquisition,Announced,"Diagnostic Lab Corporation, Inc.",-,IQTR664915334,"TSXV:ASTN.P
Company: Auston Capital Corp.
(IQT571433603) - 4/1/2019",Operating
06/03/2019,Auston Capital Corp. (TSXV:ASTN.P),Merger/Acquisition,Cancelled,Cloris Ltd.,-,IQTR618289197,"TSXV:ASTN.P
Company: Auston Capital Corp.
(IQT571433603) - 4/1/2019",Operating
09/25/2017,Avanco Capital Corp.,Merger/Acquisition,Closed,Hill Street Beverage Company Inc. (TSXV:BEER),-,IQTR538657964,"TSXV:AAA.P
Company: Avanco Capital Corp.
(IQT424152493) - 3/24/2017",Acquired
08/17/2018,Avista Healthcare Public Acquisition Corp.,Merger/Acquisition,Closed,Organogenesis Holdings Inc. (NasdaqCM:ORGO),-,IQTR577941151,"NasdaqCM:AHPA
Company: Avista Healthcare Public Acquisition Corp.
(IQT403671096) - 1/5/2017",Acquired
12/12/2019,B. Riley Principal Merger Corp.,Merger/Acquisition,Closed,Alta Equipment Group Inc. (NYSE:ALTG),"B. Riley Principal Investments, LLC",IQTR647850350,"NYSE:BRPM
Company: B. Riley Principal Merger Corp.
(IQT605669884) - 4/25/2019",Acquired
06/24/2020,B. Riley Principal Merger Corp. II,Merger/Acquisition,Closed,"Eos Energy Enterprises, Inc. (NasdaqCM:EOSE)","B. Riley Principal Investments, LLC",IQTR673453957,"NYSE:BMRG
Company: B. Riley Principal Merger Corp. II
(IQT665508019) - 6/3/2020",Acquired
04/02/2018,Baetis Ventures Ltd.,Merger/Acquisition,Closed,RE Royalties Ltd. (TSXV:RE),-,IQTR557916710,"TSXV:BATS.P
Company: Baetis Ventures Ltd.
(IQT552152839) - 2/14/2018",Acquired
04/04/2018,"Bally, Corp. (OTCPK:BLYQ)",Merger/Acquisition,Closed,-,"Aureas Capital Co., Ltd.; NYJJ Investments Limited",IQTR558168019,"OTCPK:BLYQ
Company: Bally, Corp.
(IQT278101791) - 10/22/2018",Operating
07/11/2016,"Bally, Corp. (OTCPK:BLYQ)",Merger/Acquisition,Closed,"Aureas Capital Co., Ltd.",-,IQTR378067502,"OTCPK:BLYQ
Company: Bally, Corp.
(IQT278101791) - 10/22/2018",Operating
09/15/2020,Baltic I Acquisition Corp. (TSXV:BLTC.P),Merger/Acquisition,Announced,Alpha Exploration Limited,-,IQTR688561320,"TSXV:BLTC.P
Company: Baltic I Acquisition Corp.
(IQT637537136) - 3/23/2020",Operating
01/09/2018,Barington/Hilco Acquisition Corp.,Merger/Acquisition,Effective,"Sweiss Ventures, LLC; Pla 99, LLC; BAG Spac 1, LLC; DMZ1 Holdings, LLC; Oreva Partners, LLC","Hilco Merchant Resources LLC; Barington Companies Advisors, LLC",IQTR548982643,"OTCPK:BHAC
Company: Barington/Hilco Acquisition Corp.
(IQT287409658) - 3/17/2015",Operating
05/15/2017,Barington/Hilco Acquisition Corp.,Merger/Acquisition,Cancelled,Oomba GameWorks,"Woodland Partners; EarlyBirdCapital, Inc.; Hilco Trading, LLC; K2 & Associates Investment Management Inc.",IQTR431073116,"OTCPK:BHAC
Company: Barington/Hilco Acquisition Corp.
(IQT287409658) - 3/17/2015",Operating
10/14/2020,Battery Road Capital Corp. (TSXV:BTRY.P),Merger/Acquisition,Announced,E-Tech Kalapuse Mining (Pty) Ltd.,-,IQTR691853177,"TSXV:BTRY.P
Company: Battery Road Capital Corp.
(IQT572191630) - 10/3/2018",Operating
08/04/2020,BB1 Acquisition Corp. (TSXV:BBA.P),Merger/Acquisition,Announced,Cerrado Gold Inc.,-,IQTR682086897,"TSXV:BBA.P
Company: BB1 Acquisition Corp.
(IQT576454455) - 2/3/2020",Operating
01/24/2019,BB1 Acquisition Corp. (TSXV:BBA.P),Merger/Acquisition,Cancelled,PLANTEXT Ltd.,-,IQTR599818807,"TSXV:BBA.P
Company: BB1 Acquisition Corp.
(IQT576454455) - 2/3/2020",Operating
03/27/2020,Big Dougie Capital Corp.,Merger/Acquisition,Closed,Stuve Gold Corp. (TSXV:STUV),-,IQTR661027014,"TSXV:STUV.P
Company: Big Dougie Capital Corp.
(IQT553666924) - 7/27/2018",Acquired
05/13/2019,Big Dougie Capital Corp.,Merger/Acquisition,Cancelled,LaSanta Botanicals Ltd.,-,IQTR613283350,"TSXV:STUV.P
Company: Big Dougie Capital Corp.
(IQT553666924) - 7/27/2018",Acquired
05/24/2018,"Big Time Holdings, Inc.",Merger/Acquisition,Closed,Palewater Global Management Inc.,-,IQTR567482103,"OTCPK:BTHI
Company: Big Time Holdings, Inc.
(IQT552992031) - 2/23/2018",Operating Subsidiary
09/12/2018,Bison Capital Acquisition Corp.,Merger/Acquisition,Closed,"Xynomic Pharmaceuticals Holdings, Inc. (OTCPK:XYNO)",-,IQTR580934459,"NasdaqCM:XYN
Company: Bison Capital Acquisition Corp.
(IQT531181289) - 7/18/2017",Acquired
11/09/2020,Black Lion Capital Corp. (TSXV:BLC.H),Merger/Acquisition,Announced,2204901 Ontario Inc,-,IQTR695548420,"TSXV:BLC.H
Company: Black Lion Capital Corp.
(IQT328468728) - 5/5/2016",Operating
08/08/2016,Black Lion Capital Corp. (TSXV:BLC.H),Merger/Acquisition,Cancelled,Thomson Power Inc.,-,IQTR379373407,"TSXV:BLC.H
Company: Black Lion Capital Corp.
(IQT328468728) - 5/5/2016",Operating
12/19/2018,Black Ridge Acquisition Corp.,Merger/Acquisition,Closed,Allied Esports Entertainment Inc. (NasdaqCM:AESE),"Black Ridge Oil & Gas, Inc. (OTCPK:ANFC)",IQTR595648360,"NasdaqCM:AESE
Company: Black Ridge Acquisition Corp.
(IQT529770956) - 10/25/2017",Acquired
04/06/2018,Blue Bay Capital Inc.,Merger/Acquisition,Closed,Specialty Liquid Transportation Corp. (TSXV:SLT),"SNJ Capital Ltd., Asset Management Arm",IQTR558425561,"TSXV:BLUE.P
Company: Blue Bay Capital Inc.
(IQT534023564) - 3/16/2018",Acquired
02/25/2019,BMGB Capital Corp. (TSXV:BMGB.P),Merger/Acquisition,Cancelled,-,-,IQTR604206914,"TSXV:BMGB.P
Company: BMGB Capital Corp.
(IQT589553593) - 11/8/2018",Operating
03/21/2013,"Bnet Media Group, Inc. (OTCPK:BNTT)",Merger/Acquisition,Closed,-,-,IQTR232691688,"OTCPK:BNTT
Company: Bnet Media Group, Inc.
(IQT538959144) - 5/3/2018",Operating
12/03/2012,"Bnet Media Group, Inc. (OTCPK:BNTT)",Merger/Acquisition,Announced,"bNET Communications, Inc. and EFactor Corp.",-,IQTR224869528,"OTCPK:BNTT
Company: Bnet Media Group, Inc.
(IQT538959144) - 5/3/2018",Operating
09/05/2012,"Bnet Media Group, Inc. (OTCPK:BNTT)",Merger/Acquisition,Closed,-,-,IQTR216640759,"OTCPK:BNTT
Company: Bnet Media Group, Inc.
(IQT538959144) - 5/3/2018",Operating
09/05/2012,"Bnet Media Group, Inc. (OTCPK:BNTT)",Merger/Acquisition,Closed,-,-,IQTR216642990,"OTCPK:BNTT
Company: Bnet Media Group, Inc.
(IQT538959144) - 5/3/2018",Operating
04/29/2020,Bold Capital Enterprises Ltd. (TSXV:BOLD.P),Merger/Acquisition,Announced,Dymedso Inc.,-,IQTR665989050,"TSXV:BOLD.P
Company: Bold Capital Enterprises Ltd.
(IQT594154733) - 4/23/2019",Operating
08/16/2017,Boulevard Acquisition Corp. II,Merger/Acquisition,Closed,"Estre Ambiental, Inc. (OTCPK:ESTR.F)","Glazer Capital, LLC; Basso Capital Management, L.P.; BlueMountain Capital Management LLC; Polar Asset Management Partners Inc.; Hudson Bay Capital Management LP; Castle Creek Arbitrage, LLC; Alyeska Investment Group, L.P.; Cowen Investment Management LLC; Periscope Capital Inc",IQTR534415544,"NasdaqGM:BLVD
Company: Boulevard Acquisition Corp. II
(IQT316581388) - 11/16/2015",Acquired
08/17/2020,Brachium Capital Corp. (TSXV:BRAC.P),Merger/Acquisition,Announced,WeCommerce Holdings Ltd.,-,IQTR684162324,"TSXV:BRAC.P
Company: Brachium Capital Corp.
(IQT633214953) - 12/10/2019",Operating
03/29/2017,Brassneck Capital Corp.,Merger/Acquisition,Closed,Meta Growth Corp. (TSXV:META),-,IQTR424996496,"TSXV:BC.P
Company: Brassneck Capital Corp.
(IQT319652950) - 5/12/2016",Acquired
08/02/2019,Brockton Ventures Inc.,Merger/Acquisition,Closed,TGS Esports Inc. (TSXV:TGS),-,IQTR631929723,"TSXV:BROC.P
Company: Brockton Ventures Inc.
(IQT554509925) - 10/31/2018",Acquired
08/18/2020,Buckhaven Capital Corp. (TSXV:BKH.P),Merger/Acquisition,Announced,"1254688 B.C. Ltd./Ag-Mining Investments, AB",-,IQTR684242797,"TSXV:BKH.P
Company: Buckhaven Capital Corp.
(IQT600731276) - 6/27/2019",Operating
08/09/2017,Buffalo Capital Inc.,Merger/Acquisition,Closed,Waverley Pharma Inc. (TSXV:WAVE),-,IQTR533780357,"TSXV:WAVE
Company: Buffalo Capital Inc.
(IQT429034209) - 5/9/2017",Acquired
08/07/2020,BuzBuz Capital Corp. (TSXV:BZBZ.P),Merger/Acquisition,Announced,Inolife R&D Inc.,-,IQTR682990424,"TSXV:BZBZ.P
Company: BuzBuz Capital Corp.
(IQT606024527) - 5/30/2019",Operating
07/19/2019,BuzBuz Capital Corp. (TSXV:BZBZ.P),Merger/Acquisition,Cancelled,iLLUMA - Drive Inc.,-,IQTR630113215,"TSXV:BZBZ.P
Company: BuzBuz Capital Corp.
(IQT606024527) - 5/30/2019",Operating
05/18/2020,Buzz Capital Inc. (TSXV:BUZ.P),Merger/Acquisition,Cancelled,Novamind Ventures Inc.,-,IQTR668510679,"TSXV:BUZ.P
Company: Buzz Capital Inc.
(IQT534950474) - 8/21/2017",Operating
03/16/2018,Buzz Capital Inc. (TSXV:BUZ.P),Merger/Acquisition,Cancelled,KAYA Inc.,"Huge, LLC; 2551448 Ontario Inc.; 2561352 Ontario Inc",IQTR556488947,"TSXV:BUZ.P
Company: Buzz Capital Inc.
(IQT534950474) - 8/21/2017",Operating
04/11/2019,Califfi Capital Corp. (TSXV:CFI.P),Merger/Acquisition,Cancelled,Fenix Gold Inc.,-,IQTR610040565,"TSXV:CFI.P
Company: Califfi Capital Corp.
(IQT424147168) - 7/21/2017",Operating
08/01/2018,CanadaBis Capital Inc.,Merger/Acquisition,Closed,CanadaBis Capital Inc. (TSXV:CANB),-,IQTR576053552,"TSXV:CANB
Company: CanadaBis Capital Inc.
(IQT416905614) - 3/10/2017",Acquired
01/19/2018,CanadaBis Capital Inc.,Merger/Acquisition,Cancelled,"Applied Data Finance, LLC",-,IQTR550120177,"TSXV:CANB
Company: CanadaBis Capital Inc.
(IQT416905614) - 3/10/2017",Acquired
10/17/2018,Cannabis Strategies Acquisition Corp.,Merger/Acquisition,Closed,Ayr Strategies Inc. (CNSX:AYR.A),-,IQTR587164906,"OTCPK:CBAQ.F
Company: Cannabis Strategies Acquisition Corp.
(IQT544425032) - 5/17/2018",Acquired
09/23/2020,Cann-Is Capital Corp. (TSXV:NIS.P),Merger/Acquisition,Announced,CWE European Holdings Ltd.,-,IQTR689615692,"TSXV:NIS.P
Company: Cann-Is Capital Corp.
(IQT578638923) - 9/24/2018",Operating
12/18/2015,Cantabio Pharmaceuticals Inc.,Merger/Acquisition,Closed,Cantabio Pharmaceuticals Inc. (OTCPK:CTBO),-,IQTR319864242,"OTCPK:CTBO
Company: Cantabio Pharmaceuticals Inc.
(IQT320230183) - 11/16/2015",Acquired
07/29/2014,Cantabio Pharmaceuticals Inc.,Merger/Acquisition,Closed,-,-,IQTR269347276,"OTCPK:CTBO
Company: Cantabio Pharmaceuticals Inc.
(IQT320230183) - 11/16/2015",Acquired
02/15/2019,Canvass Ventures Ltd.,Merger/Acquisition,Closed,Nanalysis Scientific Corp. (TSXV:NSCI),-,IQTR602899980,"TSXV:CVS.P
Company: Canvass Ventures Ltd.
(IQT428110437) - 6/29/2017",Acquired
02/14/2018,Canvass Ventures Ltd.,Merger/Acquisition,Cancelled,Sessionwire Communications Inc.,-,IQTR552888657,"TSXV:CVS.P
Company: Canvass Ventures Ltd.
(IQT428110437) - 6/29/2017",Acquired
04/10/2017,"CAPE-ES Special Purpose Acquisition Co., Ltd.",Merger/Acquisition,Closed,"Chemtros Co., Ltd. (KOSDAQ:A220260)","ES Investor Co., Ltd.; Hanwool Co., Ltd.",IQTR427200499,"KOSDAQ:A220260
Company: CAPE-ES Special Purpose Acquisition Co., Ltd.
(IQT306832663) - 7/27/2015",Acquired
07/28/2015,"CAPE-ES Special Purpose Acquisition Co., Ltd.",Merger/Acquisition,Closed,"Hanwool Co., Ltd.",-,IQTR307850915,"KOSDAQ:A220260
Company: CAPE-ES Special Purpose Acquisition Co., Ltd.
(IQT306832663) - 7/27/2015",Acquired
11/09/2016,Capital for Progress 1 S.p.A.,Merger/Acquisition,Closed,4AIM SICAF S.p.A. (BIT:4AIM),-,IQTR409120731,"N/A
Company: Capital for Progress 1 S.p.A.
(IQT306696313) - 8/4/2015",Operating Subsidiary
09/05/2016,Capital for Progress 1 S.p.A.,Merger/Acquisition,Closed,GPI SpA (BIT:GPI),"Banca IMI SpA, Investment Banking Arm; Unione di Banche Italiane Scpa, Asset Management Arm",IQTR414029598,"N/A
Company: Capital for Progress 1 S.p.A.
(IQT306696313) - 8/4/2015",Operating Subsidiary
03/20/2017,Capitol Acquisition Corp. III,Merger/Acquisition,Closed,Cision Ltd.,"Fir Tree Partners; Moore Capital Management, LP; Highbridge Capital Management, LLC; Glazer Capital, LLC; BlueMountain Capital Management LLC; Polar Asset Management Partners Inc.; Hudson Bay Capital Management LP; Alyeska Investment Group, L.P.; Hutchin Hill Capital, LP; Arrowgrass Capital Partners LLP; Periscope Capital Inc; Rotation Capital Management, LP",IQTR423957867,"NasdaqCM:CLAC
Company: Capitol Acquisition Corp. III
(IQT318780946) - 12/9/2015",Acquired
04/08/2019,Capitol Investment Corp. IV,Merger/Acquisition,Closed,"Nesco Holdings, Inc. (NYSE:NSCO)",-,IQTR609585938,"NYSE:CIC
Company: Capitol Investment Corp. IV
(IQT539456152) - 10/6/2017",Acquired
08/09/2019,Caprice Business Development Canada Inc.,Merger/Acquisition,Closed,Leaf Mobile Inc. (TSXV:LEAF),-,IQTR632891648,"TSXV:CAPB.P
Company: Caprice Business Development Canada Inc.
(IQT608789699) - 7/22/2019",Acquired
12/18/2017,Carlaw Capital V Corp.,Merger/Acquisition,Closed,Eve & Co Incorporated (TSXV:EVE),Capit Investment Corp.; Cinquedea Corp.,IQTR546940878,"TSXV:CVC.H
Company: Carlaw Capital V Corp.
(IQT275147836) - 3/2/2015",Acquired
05/29/2017,Carlaw Capital V Corp.,Merger/Acquisition,Cancelled,Charrua Hydrocarbons Company Ltd,Capit Investment Corp.,IQTR432458459,"TSXV:CVC.H
Company: Carlaw Capital V Corp.
(IQT275147836) - 3/2/2015",Acquired
06/01/2020,Cassowary Capital Corporation Limited,Merger/Acquisition,Closed,Western Gold Exploration Limited (TSXV:WGLD),Smaller Company Capital Ltd.; Mdcgn Ltd,IQTR670873760,"TSXV:BIRD.P
Company: Cassowary Capital Corporation Limited
(IQT570484746) - 9/13/2018",Acquired
11/22/2018,Cassowary Capital Corporation Limited,Merger/Acquisition,Cancelled,Lobo Genetics Inc.,-,IQTR592359769,"TSXV:BIRD.P
Company: Cassowary Capital Corporation Limited
(IQT570484746) - 9/13/2018",Acquired
07/31/2020,Castlebar Capital Corp. (TSXV:CBAR.P),Merger/Acquisition,Cancelled,Tellyo Oy,-,IQTR681875569,"TSXV:CBAR.P
Company: Castlebar Capital Corp.
(IQT592416169) - 7/2/2019",Operating
06/13/2019,Castlecap Capital Inc. (TSXV:CSTL.P),Merger/Acquisition,Cancelled,Plexus Technology Corp.,-,IQTR621078982,"TSXV:CSTL.P
Company: Castlecap Capital Inc.
(IQT595425883) - 3/19/2020",Operating
10/14/2020,CC Neuberger Principal Holdings I (NYSE:PCPL),Merger/Acquisition,Announced,"E2open, LLC",-,IQTR691692359,"NYSE:PCPL
Company: CC Neuberger Principal Holdings I
(IQT665335038) - 6/15/2020",Operating
06/18/2019,CE Brands Inc. (TSXV:CEBI.P),Merger/Acquisition,Announced,eBuyNow eCommerce Limited,-,IQTR622864423,"TSXV:CEBI.P
Company: CE Brands Inc.
(IQT602555468) - 5/23/2019",Operating
08/02/2020,CF Finance Acquisition Corp.,Merger/Acquisition,Closed,GCM Grosvenor Inc. (NasdaqGM:GCMG),"Glazer Capital, LLC; AQR Capital Management, LLC; Adage Capital Management, L.P.; Hudson Bay Capital Management LP; MM Asset Management Inc",IQTR681880146,"NasdaqCM:CFFA
Company: CF Finance Acquisition Corp.
(IQT600189663) - 2/5/2019",Acquired
11/30/2020,CF Finance Acquisition Corp. II (NasdaqCM:CFII),Merger/Acquisition,Announced,"View, Inc.",-,IQTR696503690,"NasdaqCM:CFII
Company: CF Finance Acquisition Corp. II
(IQT691712457) - 10/19/2020",Operating
05/07/2019,ChaiNode Opportunities Corp.,Merger/Acquisition,Closed,Doré Copper Mining Corp. (TSXV:DCMC),-,IQTR612702797,"TSXV:CXD.P
Company: ChaiNode Opportunities Corp.
(IQT578209465) - 1/24/2019",Acquired
08/19/2020,Challenger Acquisitions Limited (LSE:CHAL),Merger/Acquisition,Announced,Cindrigo Ltd.,-,IQTR684342785,"LSE:CHAL
Company: Challenger Acquisitions Limited
(IQT285454418) - 2/19/2015",Operating
07/16/2019,Chardan Healthcare Acquisition Corp.,Merger/Acquisition,Closed,BiomX Inc. (AMEX:PHGE),-,IQTR629714842,"AMEX:PHGE
Company: Chardan Healthcare Acquisition Corp.
(IQT592931131) - 3/13/2019",Acquired
11/13/2019,ChaSerg Technology Acquisition Corp.,Merger/Acquisition,Closed,"Grid Dynamics Holdings, Inc. (NasdaqCM:GDYN)",-,IQTR644099373,"NasdaqCM:GDYN
Company: ChaSerg Technology Acquisition Corp.
(IQT589420002) - 10/30/2018",Acquired
